{
  "schemaVersion": 1,
  "id": "v148/open-font-format-avar2-text-shaping-and-glyph-rendering",
  "route": "/v148/open-font-format-avar2-text-shaping-and-glyph-rendering/",
  "kind": "platform-capability",
  "completeness": "implementation-sufficient",
  "assessedAt": "2026-10-07",
  "assessor": "gendn-audit B2 worker (b2w2)",
  "sources": [
    {
      "id": "chromestatus",
      "label": "ChromeStatus feature 5169590743203840 — Open Font Format avar2 text shaping and glyph rendering",
      "url": "https://chromestatus.com/feature/5169590743203840",
      "kind": "browser-data"
    },
    {
      "id": "chromestatus-api",
      "label": "ChromeStatus API feature record 5169590743203840",
      "url": "https://chromestatus.com/api/v0/features/5169590743203840",
      "kind": "browser-data"
    },
    {
      "id": "listing",
      "label": "ChromeStatus milestone=148 listing",
      "url": "https://chromestatus.com/api/v0/features?milestone=148",
      "kind": "browser-data"
    },
    {
      "id": "spec-opentype-avar",
      "label": "OpenType — avar Axis Variations table specification",
      "url": "https://learn.microsoft.com/en-us/typography/opentype/spec/avar",
      "kind": "normative-spec"
    },
    {
      "id": "explainer-boring-spec",
      "label": "Boring Expansion Spec — avar2 (HarfBuzz)",
      "url": "https://github.com/harfbuzz/boring-expansion-spec/blob/main/avar2.md",
      "kind": "explainer"
    },
    {
      "id": "css-fonts-4-tech",
      "label": "CSS Fonts Module Level 4 — font-face src: tech() function",
      "url": "https://drafts.csswg.org/css-fonts-4/#font-face-src-tech",
      "kind": "normative-spec"
    },
    {
      "id": "csswg-issue-10599",
      "label": "w3c/csswg-drafts issue #10599 — tech(avar2) value registration",
      "url": "https://github.com/w3c/csswg-drafts/issues/10599",
      "kind": "normative-spec"
    },
    {
      "id": "intent-ship",
      "label": "blink-dev Intent to Ship: Open Font Format avar2 text shaping and glyph rendering",
      "url": "https://groups.google.com/a/chromium.org/g/blink-dev/c/VCQBQlxEaa8/m/IAzfn-02DgAJ",
      "kind": "intent"
    },
    {
      "id": "mdn-variable-fonts",
      "label": "MDN: Variable fonts guide",
      "url": "https://developer.mozilla.org/en-US/docs/Web/CSS/Guides/Fonts/Variable_fonts",
      "kind": "release-doc"
    },
    {
      "id": "bcd-font-face",
      "label": "BCD css/at-rules/font-face.json",
      "url": "https://github.com/mdn/browser-compat-data/blob/main/css/at-rules/font-face.json",
      "kind": "browser-data"
    },
    {
      "id": "webstatus",
      "label": "webstatus.dev — variable-fonts web-feature",
      "url": "https://webstatus.dev/features/variable-fonts",
      "kind": "browser-data"
    },
    {
      "id": "crbug",
      "label": "Chromium tracking issue 40246300 — Enable HarfBuzz avar2 compile flag",
      "url": "https://issues.chromium.org/issues/40246300",
      "kind": "other"
    },
    {
      "id": "showcase",
      "label": "chrome-platform-showcase — open-font-format-avar2 demo",
      "url": "https://chrome-platform-showcase.paulkinlan-ea.deno.net/v148/open-font-format-avar2-text-shaping-and-glyph-rendering/",
      "kind": "other"
    }
  ],
  "inventory": [
    {
      "id": "avar2-axis-remapping",
      "name": "OpenType avar version 2 axis remapping table support in text shaping and glyph rendering (coordinating multiple variation axes via variable deltas)",
      "kind": "capability",
      "sourceRefs": [
        "spec-opentype-avar",
        "explainer-boring-spec",
        "chromestatus",
        "intent-ship"
      ]
    },
    {
      "id": "tech-avar2",
      "name": "tech(avar2) font capability query in CSS @font-face src: descriptor",
      "kind": "css-value",
      "sourceRefs": [
        "css-fonts-4-tech",
        "csswg-issue-10599",
        "intent-ship"
      ]
    }
  ],
  "documentation": [
    {
      "inventoryId": "avar2-axis-remapping",
      "href": "#syntax",
      "dimensions": {
        "syntax": {
          "status": "documented",
          "selector": "#syntax",
          "sourceRefs": [
            "spec-opentype-avar",
            "explainer-boring-spec"
          ]
        },
        "inputs": {
          "status": "documented",
          "selector": "#syntax",
          "sourceRefs": [
            "spec-opentype-avar",
            "explainer-boring-spec"
          ]
        },
        "outputs": {
          "status": "documented",
          "selector": "#why",
          "sourceRefs": [
            "spec-opentype-avar",
            "chromestatus"
          ]
        },
        "errors": {
          "status": "not-applicable",
          "selector": "#syntax",
          "rationale": "Font table parsing handles unknown or malformed avar2 data gracefully per OpenType specification without throwing runtime script errors, falling back to base glyphs.",
          "sourceRefs": [
            "spec-opentype-avar"
          ]
        },
        "context": {
          "status": "documented",
          "selector": "#at-a-glance",
          "sourceRefs": [
            "chromestatus",
            "intent-ship"
          ]
        },
        "lifecycle": {
          "status": "documented",
          "selector": "#why",
          "sourceRefs": [
            "explainer-boring-spec",
            "chromestatus"
          ]
        },
        "examples": {
          "status": "documented",
          "selector": "#examples",
          "sourceRefs": [
            "explainer-boring-spec",
            "intent-ship"
          ]
        },
        "compatibility": {
          "status": "documented",
          "selector": "#browser-compatibility",
          "sourceRefs": [
            "chromestatus",
            "webstatus",
            "intent-ship"
          ]
        },
        "securityPrivacy": {
          "status": "not-applicable",
          "selector": "#at-a-glance",
          "rationale": "Internal font table parser within HarfBuzz sandboxed text shaping; does not introduce new network, storage, or cross-origin privilege surfaces.",
          "sourceRefs": [
            "chromestatus",
            "intent-ship"
          ]
        }
      }
    },
    {
      "inventoryId": "tech-avar2",
      "href": "#syntax",
      "dimensions": {
        "syntax": {
          "status": "documented",
          "selector": "#syntax",
          "sourceRefs": [
            "css-fonts-4-tech",
            "csswg-issue-10599"
          ]
        },
        "inputs": {
          "status": "documented",
          "selector": "#syntax",
          "sourceRefs": [
            "css-fonts-4-tech"
          ]
        },
        "outputs": {
          "status": "documented",
          "selector": "#syntax",
          "sourceRefs": [
            "css-fonts-4-tech"
          ]
        },
        "errors": {
          "status": "not-applicable",
          "selector": "#syntax",
          "rationale": "CSS parser ignores unsupported font tech() values per CSS cascade and fonts grammar without throwing runtime exceptions.",
          "sourceRefs": [
            "css-fonts-4-tech"
          ]
        },
        "context": {
          "status": "documented",
          "selector": "#at-a-glance",
          "sourceRefs": [
            "css-fonts-4-tech",
            "chromestatus"
          ]
        },
        "lifecycle": {
          "status": "documented",
          "selector": "#syntax",
          "sourceRefs": [
            "csswg-issue-10599",
            "intent-ship"
          ]
        },
        "examples": {
          "status": "documented",
          "selector": "#examples",
          "sourceRefs": [
            "csswg-issue-10599",
            "intent-ship"
          ]
        },
        "compatibility": {
          "status": "documented",
          "selector": "#browser-compatibility",
          "sourceRefs": [
            "chromestatus",
            "bcd-font-face"
          ]
        },
        "securityPrivacy": {
          "status": "not-applicable",
          "selector": "#at-a-glance",
          "rationale": "Declarative CSS @font-face capability query that selects between author-provided font URLs without exposing client fingerprinting data.",
          "sourceRefs": [
            "css-fonts-4-tech"
          ]
        }
      }
    }
  ],
  "notes": "Reference contract for v148/open-font-format-avar2-text-shaping-and-glyph-rendering. HarfBuzz avar2 compile flag activated in Chromium 148; CSS @font-face src: tech(avar2) query enables progressive enhancement."
}
