{
  "schemaVersion": 1,
  "id": "v153/webtransport-headers-and-responseheaders",
  "route": "/v153/webtransport-headers-and-responseheaders/",
  "kind": "web-api",
  "completeness": "implementation-sufficient",
  "assessedAt": "2026-09-13",
  "assessor": "writer self-assessment against the fetched primary sources; independent integrator review pending",
  "sources": [
    {
      "id": "spec-ed",
      "label": "WebTransport editor's draft (w3c.github.io) — IDL and prose for WebTransportOptions.headers (§6.9), WebTransport.responseHeaders (§6.3), and the constructor/connection-establishment steps (§6.2); fetched 2026-09-13",
      "url": "https://w3c.github.io/webtransport/",
      "kind": "normative-spec"
    },
    {
      "id": "spec-tr",
      "label": "WebTransport W3C TR snapshot — headers definition (the ChromeStatus record's canonical spec link; anchor verified present 2026-09-13)",
      "url": "https://www.w3.org/TR/webtransport/#dom-webtransportoptions-headers",
      "kind": "normative-spec"
    },
    {
      "id": "spec-tr-rh",
      "label": "WebTransport W3C TR snapshot — responseHeaders definition (anchor verified present 2026-09-13)",
      "url": "https://www.w3.org/TR/webtransport/#dom-webtransport-responseheaders",
      "kind": "normative-spec"
    },
    {
      "id": "spec-pr",
      "label": "w3c/webtransport PR #713 diff (patch-diff.githubusercontent.com; the canonical github.com PR page was not reachable from this build environment) — the exact spec change adding both members",
      "url": "https://patch-diff.githubusercontent.com/raw/w3c/webtransport/pull/713.diff",
      "kind": "normative-spec"
    },
    {
      "id": "fetch",
      "label": "Fetch Living Standard — Headers class, HeadersInit, fill/append algorithms, guards, forbidden request-header rules",
      "url": "https://fetch.spec.whatwg.org/#headers-class",
      "kind": "normative-spec"
    },
    {
      "id": "webidl",
      "label": "WebIDL — [SameObject] extended attribute",
      "url": "https://webidl.spec.whatwg.org/#SameObject",
      "kind": "normative-spec"
    },
    {
      "id": "intent",
      "label": "blink-dev — Intent to Ship: WebTransport headers and responseHeaders (Sep 2026; flag names, WPT link, platform coverage, security analysis)",
      "url": "https://groups.google.com/a/chromium.org/g/blink-dev/c/9xhgeOZhvWE/m/WKcocE4aAgAJ",
      "kind": "intent"
    },
    {
      "id": "chromestatus",
      "label": "ChromeStatus feature record 5194104408506368 — WebTransport headers and responseHeaders",
      "url": "https://chromestatus.com/feature/5194104408506368",
      "kind": "browser-data"
    },
    {
      "id": "milestone-153",
      "label": "ChromeStatus milestone=153 listing — feature appears under 'In developer trial (Behind a flag)' with the listing name used for this slug (verified 2026-09-13)",
      "url": "https://chromestatus.com/api/v0/features?milestone=153",
      "kind": "browser-data"
    },
    {
      "id": "milestone-155",
      "label": "ChromeStatus milestone=155 listing — same feature id under 'Enabled by default' (the slated shipping milestone; verified 2026-09-13)",
      "url": "https://chromestatus.com/api/v0/features?milestone=155",
      "kind": "browser-data"
    },
    {
      "id": "runtime-flags",
      "label": "Chromium runtime_enabled_features.json5 — WebTransportHeaders record, status experimental (trunk, fetched 2026-09-13)",
      "url": "https://chromium.googlesource.com/chromium/src/+/main/third_party/blink/renderer/platform/runtime_enabled_features.json5",
      "kind": "browser-data"
    },
    {
      "id": "bcd",
      "label": "MDN browser-compat-data api/WebTransport.json — responseHeaders entry (experimental; chrome/firefox false, safari preview); no subfeature exists for the headers constructor option (fetched 2026-09-13)",
      "url": "https://raw.githubusercontent.com/mdn/browser-compat-data/main/api/WebTransport.json",
      "kind": "browser-data"
    },
    {
      "id": "webstatus",
      "label": "webstatus.dev query 'webtransport' — only the umbrella webtransport feature (Baseline newly available 2026-03-24); no entry for this addition (checked 2026-09-13)",
      "url": "https://api.webstatus.dev/v1/features?q=webtransport",
      "kind": "browser-data"
    },
    {
      "id": "wpt",
      "label": "wpt.fyi — webtransport/headers.https.any.html (the WPT coverage the Intent to Ship cites)",
      "url": "https://wpt.fyi/results/webtransport/headers.https.any.html?label=experimental&label=master&aligned",
      "kind": "test"
    },
    {
      "id": "webtrans-http3",
      "label": "draft-ietf-webtrans-http3 — the extended-CONNECT handshake and SETTINGS_ENABLE_WEBTRANSPORT",
      "url": "https://datatracker.ietf.org/doc/html/draft-ietf-webtrans-http3",
      "kind": "normative-spec"
    }
  ],
  "inventory": [
    {
      "id": "webtransportoptions-headers",
      "name": "WebTransportOptions.headers",
      "kind": "field",
      "sourceRefs": ["spec-ed", "spec-tr", "spec-pr", "fetch"]
    },
    {
      "id": "webtransport-responseheaders",
      "name": "WebTransport.responseHeaders",
      "kind": "attribute",
      "sourceRefs": ["spec-ed", "spec-tr-rh", "spec-pr", "fetch", "webidl"]
    }
  ],
  "documentation": [
    {
      "inventoryId": "webtransportoptions-headers",
      "href": "headers/",
      "dimensions": {
        "syntax": {
          "status": "documented",
          "selector": "#syntax",
          "sourceRefs": ["spec-ed", "fetch"]
        },
        "inputs": {
          "status": "documented",
          "selector": "#values",
          "sourceRefs": ["spec-ed", "fetch"]
        },
        "outputs": {
          "status": "documented",
          "selector": "#effects",
          "sourceRefs": ["spec-ed", "chromestatus"]
        },
        "errors": {
          "status": "documented",
          "selector": "#exceptions",
          "sourceRefs": ["spec-ed", "fetch"]
        },
        "context": {
          "status": "documented",
          "selector": "#context",
          "sourceRefs": ["spec-ed", "chromestatus", "intent", "webtrans-http3", "runtime-flags"]
        },
        "lifecycle": {
          "status": "documented",
          "selector": "#lifecycle",
          "sourceRefs": ["spec-ed"]
        },
        "examples": {
          "status": "documented",
          "selector": "#examples",
          "sourceRefs": ["spec-ed", "fetch", "intent"]
        },
        "compatibility": {
          "status": "documented",
          "selector": "#compatibility",
          "sourceRefs": ["bcd", "chromestatus", "milestone-153", "milestone-155", "intent"]
        },
        "securityPrivacy": {
          "status": "documented",
          "selector": "#security-and-privacy",
          "sourceRefs": ["chromestatus", "intent", "fetch"]
        }
      }
    },
    {
      "inventoryId": "webtransport-responseheaders",
      "href": "responseheaders/",
      "dimensions": {
        "syntax": {
          "status": "documented",
          "selector": "#syntax",
          "sourceRefs": ["spec-ed", "webidl"]
        },
        "inputs": {
          "status": "not-applicable",
          "rationale": "A readonly IDL attribute takes no inputs; the getter steps are simply 'return this's [[ResponseHeaders]]' (editor's draft §6.3). What populates the slot is documented under value/lifecycle.",
          "sourceRefs": ["spec-ed"],
          "selector": "#value"
        },
        "outputs": {
          "status": "documented",
          "selector": "#value",
          "sourceRefs": ["spec-ed", "fetch"]
        },
        "errors": {
          "status": "documented",
          "selector": "#exceptions",
          "sourceRefs": ["spec-ed", "fetch"]
        },
        "context": {
          "status": "documented",
          "selector": "#context",
          "sourceRefs": ["spec-ed", "intent", "runtime-flags", "webtrans-http3"]
        },
        "lifecycle": {
          "status": "documented",
          "selector": "#lifecycle",
          "sourceRefs": ["spec-ed"]
        },
        "examples": {
          "status": "documented",
          "selector": "#examples",
          "sourceRefs": ["spec-ed", "fetch"]
        },
        "compatibility": {
          "status": "documented",
          "selector": "#compatibility",
          "sourceRefs": ["bcd", "chromestatus", "milestone-153", "milestone-155"]
        },
        "securityPrivacy": {
          "status": "documented",
          "selector": "#security-and-privacy",
          "sourceRefs": ["spec-ed", "fetch", "chromestatus"]
        }
      }
    }
  ],
  "notes": "Inventory is the complete developer-facing surface added by spec PR #713: one WebTransportOptions dictionary member and one WebTransport readonly attribute. Headers/HeadersInit and their guard semantics are external Fetch types, referenced not inventoried; wt-available-protocols and wt-protocol are wire-level headers owned by the separate protocols feature and are documented here only where they constrain these two members. The canonical github.com URLs for spec PR #713, issue #263, and WebKit PR 61874 returned HTTP 403 through this build environment's proxy, so the pages link the verified patch-diff.githubusercontent.com diffs instead and attribute issue #263 via the linked Intent to Ship. Behavior is source-derived, not runtime-verified: no flag-enabled Chrome 153 with a SETTINGS_ENABLE_WEBTRANSPORT server was available."
}
