{
  "schemaVersion": 1,
  "id": "v151/remove-legacynointerfaceobject-from-fontfaceset-idl",
  "route": "/v151/remove-legacynointerfaceobject-from-fontfaceset-idl/",
  "kind": "web-api",
  "completeness": "implementation-sufficient",
  "assessedAt": "2026-10-07",
  "assessor": "gendn-audit B5 worker (b5w2)",
  "sources": [
    {
      "id": "chromestatus",
      "label": "ChromeStatus feature 5123999844663296 — Remove [LegacyNoInterfaceObject] from FontFaceSet IDL",
      "url": "https://chromestatus.com/feature/5123999844663296",
      "kind": "browser-data"
    },
    {
      "id": "chromestatus-api",
      "label": "ChromeStatus API record — feature 5123999844663296",
      "url": "https://chromestatus.com/api/v0/features/5123999844663296",
      "kind": "browser-data"
    },
    {
      "id": "css-font-loading-spec",
      "label": "CSS Font Loading specification — §3 The FontFaceSet Interface",
      "url": "https://drafts.csswg.org/css-font-loading/#fontfaceset",
      "kind": "normative-spec"
    },
    {
      "id": "css-font-loading-interface",
      "label": "CSS Font Loading — FontFaceSet interface IDL definition",
      "url": "https://drafts.csswg.org/css-font-loading/#FontFaceSet-interface",
      "kind": "normative-spec"
    },
    {
      "id": "chromium-issue",
      "label": "Chromium Issue 477568263 — Remove [LegacyNoInterfaceObject] from FontFaceSet IDL",
      "url": "https://issues.chromium.org/issues/477568263",
      "kind": "other"
    },
    {
      "id": "mdn-fontfaceset",
      "label": "MDN Web Docs — FontFaceSet interface reference",
      "url": "https://developer.mozilla.org/en-US/docs/Web/API/FontFaceSet",
      "kind": "release-doc"
    },
    {
      "id": "webkit-bug",
      "label": "WebKit Bug 276794 — Expose FontFaceSet interface object",
      "url": "https://bugs.webkit.org/show_bug.cgi?id=276794",
      "kind": "other"
    },
    {
      "id": "wpt-results",
      "label": "WPT results — css/css-font-loading/historical.html",
      "url": "https://wpt.fyi/results/css/css-font-loading/historical.html",
      "kind": "test"
    },
    {
      "id": "webidl-spec",
      "label": "Web IDL — [LegacyNoInterfaceObject] extended attribute definition",
      "url": "https://webidl.spec.whatwg.org/#LegacyNoInterfaceObject",
      "kind": "normative-spec"
    },
    {
      "id": "wpt-test-file",
      "label": "WPT repository — css/css-font-loading/historical.html test source",
      "url": "https://github.com/web-platform-tests/wpt/blob/master/css/css-font-loading/historical.html",
      "kind": "test"
    }
  ],
  "inventory": [
    {
      "id": "fontfaceset-interface",
      "name": "FontFaceSet interface object exposed on Window and WorkerGlobalScope",
      "kind": "interface",
      "sourceRefs": [
        "chromestatus",
        "chromestatus-api",
        "css-font-loading-spec",
        "css-font-loading-interface",
        "webidl-spec",
        "chromium-issue",
        "mdn-fontfaceset",
        "webkit-bug",
        "wpt-results",
        "wpt-test-file"
      ]
    }
  ],
  "documentation": [
    {
      "inventoryId": "fontfaceset-interface",
      "href": "#syntax",
      "dimensions": {
        "syntax": {
          "status": "documented",
          "selector": "#syntax",
          "sourceRefs": [
            "css-font-loading-spec",
            "css-font-loading-interface",
            "webidl-spec",
            "chromium-issue"
          ]
        },
        "inputs": {
          "status": "documented",
          "selector": "#inputs",
          "sourceRefs": [
            "css-font-loading-interface"
          ]
        },
        "outputs": {
          "status": "documented",
          "selector": "#outputs",
          "sourceRefs": [
            "mdn-fontfaceset"
          ]
        },
        "errors": {
          "status": "documented",
          "selector": "#errors",
          "sourceRefs": [
            "wpt-results",
            "wpt-test-file"
          ]
        },
        "context": {
          "status": "documented",
          "selector": "#context",
          "sourceRefs": [
            "css-font-loading-interface"
          ]
        },
        "lifecycle": {
          "status": "documented",
          "selector": "#lifecycle",
          "sourceRefs": [
            "mdn-fontfaceset"
          ]
        },
        "examples": {
          "status": "documented",
          "selector": "#examples",
          "sourceRefs": [
            "css-font-loading-interface"
          ]
        },
        "compatibility": {
          "status": "documented",
          "selector": "#browser-compatibility",
          "sourceRefs": [
            "chromestatus",
            "webkit-bug"
          ]
        },
        "securityPrivacy": {
          "status": "documented",
          "selector": "#security-privacy",
          "sourceRefs": [
            "chromium-issue"
          ]
        }
      }
    }
  ]
}
