{
  "schemaVersion": 1,
  "id": "v150/clone-into-all-descendant-selectedcontent-elements",
  "route": "/v150/clone-into-all-descendant-selectedcontent-elements/",
  "kind": "html",
  "completeness": "implementation-sufficient",
  "assessedAt": "2026-10-07",
  "assessor": "gendn-impl campaign B4 unit (worker-drafted, implementer-committed under gendn-yaa; independent cross-family review pending)",
  "sources": [
    {
      "id": "chromestatus",
      "label": "ChromeStatus feature 5863985044914176 — Clone into all descendant selectedcontent elements",
      "url": "https://chromestatus.com/feature/5863985044914176",
      "kind": "browser-data"
    },
    {
      "id": "whatwg-pr",
      "label": "whatwg/html PR #12263 — Keep all descendant selectedcontent elements up to date (merged spec change)",
      "url": "https://github.com/whatwg/html/pull/12263",
      "kind": "normative-spec"
    }
  ],
  "inventory": [
    {
      "id": "selectedcontent-clone-behavior",
      "name": "<selectedcontent> element — clone-into-all-descendants and deferred-update behavior",
      "kind": "element",
      "sourceRefs": [
        "whatwg-pr",
        "chromestatus"
      ]
    }
  ],
  "documentation": [
    {
      "inventoryId": "selectedcontent-clone-behavior",
      "href": "#syntax",
      "dimensions": {
        "syntax": {
          "status": "documented",
          "selector": "#syntax",
          "sourceRefs": [
            "whatwg-pr",
            "chromestatus"
          ],
          "rationale": "The feature adds no new IDL, element, or attribute: it is a behaviour change to the existing <selectedcontent> element. The page has no dedicated 'syntax' or 'shape of the API' section, so the syntax id sits on the example heading, whose <pre><code> block is the only place the page shows the developer-facing shape — <selectedcontent> markup nested inside <select> and <button>."
        },
        "inputs": {
          "status": "documented",
          "selector": "#syntax",
          "sourceRefs": [
            "whatwg-pr",
            "chromestatus"
          ],
          "rationale": "The inputs are the author-written markup the page's example shows: a <select> containing one or more <button> elements each wrapping a <selectedcontent>, plus the <option> elements whose content is cloned. No new arguments, attributes, or parameters are introduced."
        },
        "outputs": {
          "status": "documented",
          "selector": "#what-this-fixes",
          "sourceRefs": [
            "whatwg-pr",
            "chromestatus"
          ],
          "rationale": "The what-this-fixes table states the observable outputs: every <selectedcontent> element in the same <select> is kept in sync when the selection changes (previously only the first in DOM order), and updates during insertion/removal are deferred via post-insertion steps or a microtask."
        },
        "errors": {
          "status": "not-applicable",
          "selector": "#what-this-fixes",
          "rationale": "The page documents no error or exception path: as a behavioural fix to the existing <selectedcontent> element there is no throwing surface, and no error condition is named anywhere in the page's prose or tables.",
          "sourceRefs": [
            "chromestatus"
          ]
        },
        "context": {
          "status": "documented",
          "selector": "#at-a-glance",
          "sourceRefs": [
            "chromestatus"
          ],
          "rationale": "The at-a-glance table fixes the exposure context: Shipped in Chrome 150 (Enabled by default), Status Enabled by default, API change 'Behavioural fix — edge cases of the <selectedcontent> element', the spec link whatwg/html#12263, Firefox and Safari 'No signal', and the ChromeStatus record 5863985044914176."
        },
        "lifecycle": {
          "status": "documented",
          "selector": "#what-this-fixes",
          "sourceRefs": [
            "whatwg-pr",
            "chromestatus"
          ],
          "rationale": "The only lifecycle-relevant content is the update-timing change in the what-this-fixes table: an update that would occur during DOM insertion or removal steps is deferred via post-insertion steps or a microtask. There is no author-managed construction or teardown."
        },
        "examples": {
          "status": "documented",
          "selector": "#syntax",
          "sourceRefs": [
            "whatwg-pr"
          ],
          "rationale": "The page's single <pre><code> example shows a <select> with two <button> elements each wrapping a <selectedcontent>, and states that after Chrome 150 both are cloned from the selected <option> (before, only the first reflected the selection)."
        },
        "compatibility": {
          "status": "documented",
          "selector": "#browser-support",
          "sourceRefs": [
            "chromestatus"
          ],
          "rationale": "The browser-support table lists Chrome 150+ 'Enabled by default (with this fix)' on all platforms, and Firefox/Safari 'No signal'. The ChromeStatus record corroborates desktop/android/webview 150 and Firefox/Safari 'No signal'."
        },
        "securityPrivacy": {
          "status": "not-applicable",
          "selector": "#what-this-fixes",
          "rationale": "The change adds no permission, origin, storage, network or script-readable surface; the page's 'security issues' phrase refers to the bug being fixed (updates during DOM insertion) rather than to a new security or privacy contract.",
          "sourceRefs": [
            "chromestatus"
          ]
        }
      }
    }
  ],
  "notes": "PAGE EDIT (ids only, no prose/structure/styling change): five existing <h2> headings gained ids — at-a-glance (context), what-this-fixes (outputs, errors anchor, lifecycle), syntax on the example heading (syntax, inputs, examples), browser-support (compatibility), see-also (final reference section, no dimension maps to it). Every id sits on the heading element itself, never on a <section>; the page has no <h3> at all, so no heading immediately opens a subheading and no id resolves to an empty fragment. The three canonical ids required by the brief (syntax, browser-support, see-also) are present; at-a-glance and what-this-fixes are the two additional ids the contract needs so that context/outputs/lifecycle map to the fragments that actually contain that content rather than being dodged as not-applicable. SURFACE: a behaviour change to the existing <selectedcontent> element, so the inventory is one item (the element's clone-into-all-descendants / deferred-update behavior) and no second surface is invented. The page's single <pre><code> block is HTML markup, not WebIDL, so the declared-surface check is vacuous here. SOURCES RE-FETCHED, NOT ASSUMED (2026-10-07): https://chromestatus.com/feature/5863985044914176 -> HTTP 200 (client-rendered shell); record values read from https://chromestatus.com/api/v0/features/5863985044914176 -> HTTP 200: name 'Clone into all descendant selectedcontent elements' (matches the page h1), summary opens 'Several small changes are being made to edge cases of the selectedcontent element' and lists both fixes (all selectedcontent elements kept up to date, and updates deferred during insertion/removal via post-insertion steps or microtasks) plus 'This is a PSA instead of an intent to ship because this only changes invalid cases or edge cases... 0.02%' (matches the page's what-this-fixes PSA sentence and the 0.02% figure), browsers.chrome desktop/android/webview all 150 (matches 'Chrome 150, Enabled by default'), ff.view and safari.view both 'No signal' (matches the page's 'No signal'), and spec_link is exactly https://github.com/whatwg/html/pull/12263 (the page's cited Spec link). https://github.com/whatwg/html/pull/12263 -> HTTP 200; GitHub API: state closed, merged true (merged 2026-09-28), title 'Keep all descendant selectedcontent elements up to date', body 'Previously only the first selectedcontent descendant of a select element was kept up to date... Now every descendant selectedcontent element that is not disabled is kept up to date'. COVERAGE NUANCE, NOT A CONTRADICTION (the page says nothing that contradicts the source, so no divergence paragraph is drafted): the PR body qualifies the new behavior as 'every descendant selectedcontent element that is not disabled', while the page's what-this-fixes table states 'All <selectedcontent> elements are kept in sync' — the page omits the 'not disabled' qualifier rather than contradicting it. DIMENSIONS THAT COULD NOT BE DOCUMENTED FROM THIS PAGE (flagged, not smoothed over): errors — not-applicable with the gap stated (no error/exception path on the page); securityPrivacy — not-applicable with the gap stated (no security/privacy contract on the page; the record's 'security issues' wording is about the bug being fixed). No divergence found between the page and either cited source."
}
