{
  "schemaVersion": 1,
  "id": "v147/update-device-memory-api-limits",
  "route": "/v147/update-device-memory-api-limits/",
  "kind": "web-api",
  "completeness": "implementation-sufficient",
  "assessedAt": "2026-09-20",
  "assessor": "writer self-assessment during MDN-shape upgrade; independent integrator review pending",
  "sources": [
    {
      "id": "spec-tr",
      "label": "Device Memory specification (W3C TR) — rounding algorithm, bounds, Sec-CH-Device-Memory ABNF",
      "url": "https://www.w3.org/TR/device-memory/",
      "kind": "normative-spec"
    },
    {
      "id": "client-hints-infrastructure",
      "label": "Client Hints Infrastructure §7.2 — ch-device-memory Permissions Policy and same-origin default",
      "url": "https://wicg.github.io/client-hints-infrastructure/#ch-device-memory",
      "kind": "normative-spec"
    },
    {
      "id": "spec-pr53",
      "label": "w3c/device-memory PR #53 — implementation-defined bounds (merged 2026-01-19)",
      "url": "https://github.com/w3c/device-memory/pull/53",
      "kind": "normative-spec"
    },
    {
      "id": "intent-ship",
      "label": "blink-dev Intent to Ship — Update Device Memory API limits",
      "url": "https://groups.google.com/a/chromium.org/g/blink-dev/c/vXtAmrVZeDk",
      "kind": "intent"
    },
    {
      "id": "mail-archive",
      "label": "mail-archive msg15601 — archived Intent to Ship",
      "url": "https://www.mail-archive.com/blink-dev@chromium.org/msg15601.html",
      "kind": "intent"
    },
    {
      "id": "bcd",
      "label": "BCD api/Navigator.json — deviceMemory (147 bucket notes)",
      "url": "https://github.com/mdn/browser-compat-data/blob/main/api/Navigator.json",
      "kind": "browser-data"
    },
    {
      "id": "webstatus",
      "label": "webstatus.dev — device-memory web-feature (Baseline limited)",
      "url": "https://api.webstatus.dev/v1/features/device-memory",
      "kind": "browser-data"
    },
    {
      "id": "chromestatus-api",
      "label": "ChromeStatus API record 6330376953921536 (finch flag, vendor views)",
      "url": "https://chromestatus.com/api/v0/features/6330376953921536",
      "kind": "browser-data"
    },
    {
      "id": "milestone-listing",
      "label": "ChromeStatus milestone=147 listing",
      "url": "https://chromestatus.com/api/v0/features?milestone=147",
      "kind": "browser-data"
    },
    {
      "id": "mozilla-thread",
      "label": "mozilla.dev.platform thread — Firefox view (no signal)",
      "url": "https://groups.google.com/g/mozilla.dev.platform/c/cfydu35XdnY/m/3IqYn0oJAQAJ",
      "kind": "browser-data"
    },
    {
      "id": "webkit-issue",
      "label": "w3c/device-memory issue #24 — WebKit negative position",
      "url": "https://github.com/w3c/device-memory/issues/24",
      "kind": "browser-data"
    },
    {
      "id": "mdn-header",
      "label": "MDN — Device-Memory header (legacy hint)",
      "url": "https://developer.mozilla.org/en-US/docs/Web/HTTP/Reference/Headers/Device-Memory",
      "kind": "other"
    },
    {
      "id": "cps",
      "label": "Chrome Platform Showcase — Device Memory demos (five concepts)",
      "url": "https://chrome-platform-showcase.paulkinlan-ea.deno.net/v147/update-device-memory-api-limits/",
      "kind": "other"
    }
  ],
  "inventory": [
    {
      "id": "bucket-limits-change",
      "name": "Chrome 147 bucket-limit change (Android drops 0.25/0.5, desktop adds 16/32)",
      "kind": "migration",
      "sourceRefs": ["intent-ship", "bcd", "spec-pr53"]
    },
    {
      "id": "navigator-devicememory",
      "name": "navigator.deviceMemory getter (values it can now report)",
      "kind": "property",
      "sourceRefs": ["spec-tr", "bcd"]
    },
    {
      "id": "sec-ch-device-memory-header",
      "name": "Sec-CH-Device-Memory client hint (same bucketed value)",
      "kind": "header",
      "sourceRefs": ["spec-tr"]
    }
  ],
  "documentation": [
    {
      "inventoryId": "bucket-limits-change",
      "href": "#what-changed",
      "dimensions": {
        "syntax": {
          "status": "documented",
          "selector": "#syntax",
          "sourceRefs": ["spec-tr", "spec-pr53"]
        },
        "inputs": {
          "status": "documented",
          "selector": "#what-changed",
          "sourceRefs": ["intent-ship"]
        },
        "outputs": {
          "status": "documented",
          "selector": "#what-changed",
          "sourceRefs": ["intent-ship", "bcd"]
        },
        "errors": {
          "status": "not-applicable",
          "selector": "#examples",
          "rationale": "The change has no error surface — the getter and hint always report a valid bucket. The developer-facing hazard is behavioral: branches keyed to removed buckets (e.g. deviceMemory < 1 on Android) become unreachable, which the examples fragment documents explicitly.",
          "sourceRefs": ["intent-ship"]
        },
        "context": {
          "status": "documented",
          "selector": "#at-a-glance",
          "sourceRefs": ["milestone-listing", "chromestatus-api"]
        },
        "lifecycle": {
          "status": "documented",
          "selector": "#what-changed",
          "sourceRefs": ["intent-ship", "bcd"]
        },
        "examples": {
          "status": "documented",
          "selector": "#examples",
          "sourceRefs": ["intent-ship", "cps"]
        },
        "compatibility": {
          "status": "documented",
          "selector": "#compatibility",
          "sourceRefs": ["bcd", "webstatus", "chromestatus-api"]
        },
        "securityPrivacy": {
          "status": "documented",
          "selector": "#security-and-privacy",
          "sourceRefs": ["spec-tr", "spec-pr53"]
        }
      }
    },
    {
      "inventoryId": "navigator-devicememory",
      "href": "#syntax",
      "dimensions": {
        "syntax": {
          "status": "documented",
          "selector": "#syntax",
          "sourceRefs": ["spec-tr"]
        },
        "inputs": {
          "status": "documented",
          "selector": "#syntax",
          "sourceRefs": ["spec-tr"]
        },
        "outputs": {
          "status": "documented",
          "selector": "#what-changed",
          "sourceRefs": ["intent-ship", "bcd"]
        },
        "errors": {
          "status": "not-applicable",
          "selector": "#syntax",
          "rationale": "A read-only double getter with no exception path in the spec algorithm: it returns a rounded, clamped value unconditionally. In non-supporting browsers the attribute is absent from the prototype entirely, so absence — not an exception — is the failure mode.",
          "sourceRefs": ["spec-tr"]
        },
        "context": {
          "status": "documented",
          "selector": "#syntax",
          "sourceRefs": ["spec-tr"]
        },
        "lifecycle": {
          "status": "documented",
          "selector": "#what-changed",
          "sourceRefs": ["intent-ship", "bcd"]
        },
        "examples": {
          "status": "documented",
          "selector": "#examples",
          "sourceRefs": ["intent-ship"]
        },
        "compatibility": {
          "status": "documented",
          "selector": "#compatibility",
          "sourceRefs": ["bcd", "webstatus", "mozilla-thread", "webkit-issue"]
        },
        "securityPrivacy": {
          "status": "documented",
          "selector": "#security-and-privacy",
          "sourceRefs": ["spec-tr"]
        }
      }
    },
    {
      "inventoryId": "sec-ch-device-memory-header",
      "href": "#syntax",
      "dimensions": {
        "syntax": {
          "status": "documented",
          "selector": "#syntax",
          "sourceRefs": ["spec-tr"]
        },
        "inputs": {
          "status": "documented",
          "selector": "#security-and-privacy",
          "sourceRefs": ["spec-tr", "client-hints-infrastructure"]
        },
        "outputs": {
          "status": "documented",
          "selector": "#examples",
          "sourceRefs": ["spec-tr", "mdn-header"]
        },
        "errors": {
          "status": "not-applicable",
          "selector": "#security-and-privacy",
          "rationale": "A client hint has no error channel: when the origin has not opted in via Accept-CH, or cross-origin delegation is not granted, the header is simply not sent — absence is the entire failure mode, as the security fragment explains.",
          "sourceRefs": ["spec-tr", "client-hints-infrastructure"]
        },
        "context": {
          "status": "documented",
          "selector": "#security-and-privacy",
          "sourceRefs": ["spec-tr", "client-hints-infrastructure"]
        },
        "lifecycle": {
          "status": "documented",
          "selector": "#examples",
          "sourceRefs": ["spec-tr"]
        },
        "examples": {
          "status": "documented",
          "selector": "#examples",
          "sourceRefs": ["spec-tr"]
        },
        "compatibility": {
          "status": "documented",
          "selector": "#compatibility",
          "sourceRefs": ["bcd", "chromestatus-api"]
        },
        "securityPrivacy": {
          "status": "documented",
          "selector": "#security-and-privacy",
          "sourceRefs": ["spec-tr", "spec-pr53", "client-hints-infrastructure"]
        }
      }
    }
  ],
  "notes": "Contract written during the 2026-09-20 MDN-shape upgrade. The page documents a bucket-limits migration on an existing Chromium-only API; the surface is the changed value set on navigator.deviceMemory and the Sec-CH-Device-Memory hint. BCD records the 147 change in its version notes, quoted verbatim in the compat table. Runtime behavior is source-derived, not executed locally."
}
