{
  "schemaVersion": 1,
  "id": "v148/webrtc-datachannel-always-negotiate-data-channels",
  "route": "/v148/webrtc-datachannel-always-negotiate-data-channels/",
  "kind": "web-api",
  "completeness": "implementation-sufficient",
  "assessedAt": "2026-10-07",
  "assessor": "gendn-audit B2 worker (b2w4)",
  "sources": [
    {
      "id": "chromestatus-api",
      "label": "ChromeStatus API record 5113419982307328 (WebRTC alwaysNegotiateDataChannels shipped in 148)",
      "url": "https://chromestatus.com/api/v0/features/5113419982307328",
      "kind": "browser-data"
    },
    {
      "id": "chromestatus-feature",
      "label": "ChromeStatus feature 5113419982307328 — WebRTC Datachannel: Always negotiate data channels",
      "url": "https://chromestatus.com/feature/5113419982307328",
      "kind": "browser-data"
    },
    {
      "id": "milestone-listing",
      "label": "ChromeStatus milestone=148 listing",
      "url": "https://chromestatus.com/api/v0/features?milestone=148",
      "kind": "browser-data"
    },
    {
      "id": "webrtc-extensions",
      "label": "WebRTC Extensions — Always negotiating datachannels",
      "url": "https://w3c.github.io/webrtc-extensions/#always-negotiating-datachannels",
      "kind": "normative-spec"
    },
    {
      "id": "webrtc-spec",
      "label": "W3C WebRTC 1.0: Real-Time Communication Between Browsers",
      "url": "https://www.w3.org/TR/webrtc/",
      "kind": "normative-spec"
    },
    {
      "id": "intent-ship",
      "label": "blink-dev Intent to Ship: WebRTC Datachannel: Always negotiate data channels",
      "url": "https://groups.google.com/a/chromium.org/g/blink-dev/c/WQZZETOMrlE/m/ayt6flM1AAAJ",
      "kind": "intent"
    },
    {
      "id": "crbug",
      "label": "Chromium issue 433898678: WebRTC always negotiate data channels",
      "url": "https://issues.chromium.org/issues/433898678",
      "kind": "other"
    },
    {
      "id": "mozilla-position",
      "label": "Mozilla standards position 1335: alwaysNegotiateDataChannels",
      "url": "https://github.com/mozilla/standards-positions/issues/1335",
      "kind": "other"
    },
    {
      "id": "webkit-position",
      "label": "WebKit standards position 599: alwaysNegotiateDataChannels",
      "url": "https://github.com/WebKit/standards-positions/issues/599",
      "kind": "other"
    },
    {
      "id": "mdn-peerconnection",
      "label": "MDN: RTCPeerConnection API documentation",
      "url": "https://developer.mozilla.org/en-US/docs/Web/API/RTCPeerConnection",
      "kind": "release-doc"
    },
    {
      "id": "mdn-datachannel",
      "label": "MDN: RTCDataChannel API documentation",
      "url": "https://developer.mozilla.org/en-US/docs/Web/API/RTCDataChannel",
      "kind": "release-doc"
    },
    {
      "id": "mdn-using-datachannels",
      "label": "MDN: Using WebRTC data channels",
      "url": "https://developer.mozilla.org/en-US/docs/Web/API/WebRTC_API/Using_data_channels",
      "kind": "release-doc"
    },
    {
      "id": "bcd",
      "label": "BCD api/RTCPeerConnection.json",
      "url": "https://github.com/mdn/browser-compat-data/blob/main/api/RTCPeerConnection.json",
      "kind": "browser-data"
    },
    {
      "id": "cps",
      "label": "Chrome Platform Showcase live demo for webrtc-datachannel-always-negotiate-data-channels",
      "url": "https://chrome-platform-showcase.paulkinlan-ea.deno.net/v148/webrtc-datachannel-always-negotiate-data-channels/",
      "kind": "other"
    }
  ],
  "inventory": [
    {
      "id": "alwaysnegotiatedatachannels-option",
      "name": "alwaysNegotiateDataChannels boolean RTCConfiguration dictionary member for RTCPeerConnection(configuration).",
      "kind": "field",
      "sourceRefs": [
        "webrtc-extensions",
        "webrtc-spec",
        "chromestatus-feature"
      ]
    },
    {
      "id": "sdp-application-msection-prenegotiation",
      "name": "SDP application m-section (m=application ...) pre-negotiation behavior in initial offers prior to any createDataChannel() invocation.",
      "kind": "capability",
      "sourceRefs": [
        "webrtc-extensions",
        "webrtc-spec",
        "chromestatus-feature"
      ]
    }
  ],
  "documentation": [
    {
      "inventoryId": "alwaysnegotiatedatachannels-option",
      "href": "#syntax",
      "dimensions": {
        "syntax": {
          "status": "documented",
          "selector": "#syntax",
          "sourceRefs": [
            "webrtc-extensions",
            "intent-ship"
          ]
        },
        "inputs": {
          "status": "documented",
          "selector": "#syntax",
          "sourceRefs": [
            "webrtc-extensions",
            "intent-ship"
          ]
        },
        "outputs": {
          "status": "documented",
          "selector": "#why-it-exists",
          "sourceRefs": [
            "webrtc-extensions",
            "chromestatus-feature"
          ]
        },
        "errors": {
          "status": "not-applicable",
          "selector": "#syntax",
          "rationale": "Setting configuration dictionary flags on RTCPeerConnection construction does not raise DOMExceptions; invalid configurations follow standard WebRTC constructor error handling.",
          "sourceRefs": [
            "webrtc-extensions"
          ]
        },
        "context": {
          "status": "documented",
          "selector": "#at-a-glance",
          "sourceRefs": [
            "chromestatus-api",
            "milestone-listing"
          ]
        },
        "lifecycle": {
          "status": "documented",
          "selector": "#at-a-glance",
          "sourceRefs": [
            "chromestatus-api",
            "milestone-listing"
          ]
        },
        "examples": {
          "status": "documented",
          "selector": "#examples",
          "sourceRefs": [
            "mdn-peerconnection",
            "mdn-datachannel"
          ]
        },
        "compatibility": {
          "status": "documented",
          "selector": "#browser-compatibility",
          "sourceRefs": [
            "chromestatus-api",
            "mozilla-position",
            "webkit-position"
          ]
        },
        "securityPrivacy": {
          "status": "not-applicable",
          "selector": "#why-it-exists",
          "rationale": "Pre-negotiating the SCTP application m-section uses existing WebRTC DTLS security and privacy constraints without exposing new origin or device data.",
          "sourceRefs": [
            "webrtc-extensions"
          ]
        }
      }
    },
    {
      "inventoryId": "sdp-application-msection-prenegotiation",
      "href": "#syntax",
      "dimensions": {
        "syntax": {
          "status": "documented",
          "selector": "#syntax",
          "sourceRefs": [
            "webrtc-extensions",
            "intent-ship"
          ]
        },
        "inputs": {
          "status": "documented",
          "selector": "#syntax",
          "sourceRefs": [
            "webrtc-extensions",
            "intent-ship"
          ]
        },
        "outputs": {
          "status": "documented",
          "selector": "#why-it-exists",
          "sourceRefs": [
            "webrtc-extensions",
            "chromestatus-feature"
          ]
        },
        "errors": {
          "status": "not-applicable",
          "selector": "#syntax",
          "rationale": "SDP negotiation proceeds through createOffer/setLocalDescription promise lifecycle; errors reject DOMExceptions according to standard WebRTC signaling rules.",
          "sourceRefs": [
            "webrtc-extensions"
          ]
        },
        "context": {
          "status": "documented",
          "selector": "#at-a-glance",
          "sourceRefs": [
            "chromestatus-api",
            "milestone-listing"
          ]
        },
        "lifecycle": {
          "status": "documented",
          "selector": "#at-a-glance",
          "sourceRefs": [
            "chromestatus-api",
            "milestone-listing"
          ]
        },
        "examples": {
          "status": "documented",
          "selector": "#examples",
          "sourceRefs": [
            "mdn-peerconnection",
            "mdn-datachannel"
          ]
        },
        "compatibility": {
          "status": "documented",
          "selector": "#browser-compatibility",
          "sourceRefs": [
            "chromestatus-api",
            "mozilla-position",
            "webkit-position"
          ]
        },
        "securityPrivacy": {
          "status": "not-applicable",
          "selector": "#why-it-exists",
          "rationale": "Pre-negotiating the SCTP application m-section uses existing WebRTC DTLS security and privacy constraints without exposing new origin or device data.",
          "sourceRefs": [
            "webrtc-extensions"
          ]
        }
      }
    }
  ],
  "notes": "Shipped enabled by default in Chrome 148 across desktop, Android, and WebView. Neither Mozilla nor WebKit has taken a public standards position. BCD tracks RTCPeerConnection without a separate alwaysNegotiateDataChannels configuration flag entry."
}
